{
  "$comment": "Derived from Voltur792/SPT@v1.3.2. Digests are of the bytes the bot downloaded and the attestation covers. Ownership proved by: unrecorded.",
  "schema": "astra.registry.version/1",
  "id": "sleep-pause-timer",
  "version": "1.3.2",
  "published_at": "2026-10-25T14:33:30Z",
  "review": "unreviewed",
  "release": {
    "kind": "github_release",
    "repo": "Voltur792/SPT",
    "tag": "v1.3.2",
    "commit": "da0544a8a86597cc0869c831cf5707ac36430430"
  },
  "artifacts": {
    "noarch": {
      "url": "https://github.com/Voltur792/SPT/releases/download/v1.3.2/sleep-pause-timer-1.3.2-noarch.astraplugin",
      "filename": "sleep-pause-timer-1.3.2-noarch.astraplugin",
      "sha256": "093943c61a16923928d6e35f43bce53bde07ea0e779a9de58ad41bcd81245ec9",
      "size": 185839
    }
  },
  "protocol": 1,
  "capabilities": [
    "tools",
    "triggers",
    "ui_contributions"
  ],
  "permissions": {
    "fire_trigger": {
      "reason": "Runs user-configured Astra automations when a named countdown completes"
    },
    "send_chat_message": {
      "reason": "Lets Astra read a temporary screenshot of your selected monitors and speak a short activity comment at the interval you enable"
    }
  }
}
