{
  "$comment": "Derived from mihailinl/AstraPlugins@doom-v0.1.1. Digests are of the bytes the bot downloaded and the attestation covers. Ownership proved by: release-author.",
  "schema": "astra.registry.version/1",
  "id": "doom",
  "version": "0.1.1",
  "published_at": "2026-08-19T06:47:45Z",
  "release": {
    "kind": "github_release",
    "repo": "mihailinl/AstraPlugins",
    "tag": "doom-v0.1.1",
    "commit": "5b5d2605961b54271b74304f6988972edb83d598"
  },
  "artifacts": {
    "linux-x64": {
      "url": "https://github.com/mihailinl/AstraPlugins/releases/download/doom-v0.1.1/doom-0.1.1-linux-x64.astraplugin",
      "filename": "doom-0.1.1-linux-x64.astraplugin",
      "sha256": "90bfffe757c5b879bcfb7c092f438ff95bba9f5db170e703208d3ca52dfa130f",
      "size": 16044583
    },
    "windows-x64": {
      "url": "https://github.com/mihailinl/AstraPlugins/releases/download/doom-v0.1.1/doom-0.1.1-windows-x64.astraplugin",
      "filename": "doom-0.1.1-windows-x64.astraplugin",
      "sha256": "cea7f51d67bd983274ff4313dbeb63a39b14fad3e29b70a33f166049d0fd569a",
      "size": 15611035
    }
  },
  "protocol": 1,
  "capabilities": [
    "dom_access",
    "ui_contributions"
  ]
}
