{
  "$comment": "Derived from dwertyfa288/dwertyfa-astra-tg@v0.1.21. Digests are of the bytes the bot downloaded and the attestation covers. Ownership proved by: unrecorded.",
  "schema": "astra.registry.version/1",
  "id": "dwertyfa-astra-tg",
  "version": "0.1.21",
  "published_at": "2026-10-25T08:35:08Z",
  "review": "unreviewed",
  "release": {
    "kind": "github_release",
    "repo": "dwertyfa288/dwertyfa-astra-tg",
    "tag": "v0.1.21",
    "commit": "55553c4c1c8004acd7deeaaabccf32f77f4280e1"
  },
  "artifacts": {
    "noarch": {
      "url": "https://github.com/dwertyfa288/dwertyfa-astra-tg/releases/download/v0.1.21/dwertyfa-astra-tg-0.1.21-noarch.astraplugin",
      "filename": "dwertyfa-astra-tg-0.1.21-noarch.astraplugin",
      "sha256": "5819a27903674bf53a8ec5d06b13eeb98a79ba50ba766b0ca605175fb55e5c60",
      "size": 3911624
    }
  },
  "protocol": 1,
  "capabilities": [
    "actions",
    "tools",
    "triggers",
    "ui_contributions"
  ],
  "permissions": {
    "fire_trigger": {
      "reason": "Starts your Telegram announcement command when a selected chat receives a message"
    },
    "send_chat_message": {
      "reason": "Chooses one of your saved auto-replies when an incoming Telegram message matches multiple rules"
    }
  }
}
