{
  "$comment": "Derived from teletemagame-dev/minecraft-for-astra@v0.3.1. Digests are of the bytes the bot downloaded and the attestation covers. Ownership proved by: well-known.",
  "schema": "astra.registry.version/1",
  "id": "minecraft-for-astra",
  "version": "0.3.1",
  "published_at": "2026-08-19T17:01:13Z",
  "release": {
    "kind": "github_release",
    "repo": "teletemagame-dev/minecraft-for-astra",
    "tag": "v0.3.1",
    "commit": "39df7257cae1310959a71877983c016a0c27cbfa"
  },
  "artifacts": {
    "noarch": {
      "url": "https://github.com/teletemagame-dev/minecraft-for-astra/releases/download/v0.3.1/minecraft-for-astra-0.3.1-noarch.astraplugin",
      "filename": "minecraft-for-astra-0.3.1-noarch.astraplugin",
      "sha256": "752b72ad52b3907ab2f95fe9086fd3bdfa89e2bc22a873da40e89d6f2854da55",
      "size": 6775139
    }
  },
  "protocol": 1,
  "capabilities": [
    "tools",
    "triggers"
  ],
  "permissions": {
    "fire_trigger": {
      "reason": "Lets your commands react to what happens in the game: chat, damage, low health, death"
    },
    "send_chat_message": {
      "reason": "Lets players talk to Astra in Minecraft chat and hear her answer there"
    },
    "set_variable": {
      "reason": "Publishes the bot's position, health and food so commands can read them without a tool call",
      "scopes": [
        "session"
      ]
    }
  }
}
