{
  "$comment": "Derived from FluffyTaill/astra-anim-studio@v1.1.4. Digests are of the bytes the bot downloaded and the attestation covers. Ownership proved by: unrecorded.",
  "schema": "astra.registry.version/1",
  "id": "anim-studio",
  "version": "1.1.4",
  "published_at": "2026-10-28T21:27:40Z",
  "review": "unreviewed",
  "release": {
    "kind": "github_release",
    "repo": "FluffyTaill/astra-anim-studio",
    "tag": "v1.1.4",
    "commit": "22403a306bf965c5e4503badc01a3b9743f23ebc"
  },
  "artifacts": {
    "noarch": {
      "url": "https://github.com/FluffyTaill/astra-anim-studio/releases/download/v1.1.4/anim-studio-1.1.4-noarch.astraplugin",
      "filename": "anim-studio-1.1.4-noarch.astraplugin",
      "sha256": "32bf20389f5ca5071c06448c3c35a4b752257a81e85d80a7a0a967d4a033eada",
      "size": 507480
    }
  },
  "protocol": 1,
  "capabilities": [
    "tools",
    "triggers",
    "ui_contributions"
  ],
  "permissions": {
    "fire_trigger": {
      "reason": "Plays the avatar's morning stretch, wave and yawn and says her phrases through the two Astra commands the plugin page creates."
    }
  }
}
