{
  "$comment": "Derived from Voltur792/astra-music@v1.4.3. Digests are of the bytes the bot downloaded and the attestation covers. Ownership proved by: unrecorded.",
  "schema": "astra.registry.version/1",
  "id": "music-controller",
  "version": "1.4.3",
  "published_at": "2026-10-25T20:17:10Z",
  "review": "unreviewed",
  "release": {
    "kind": "github_release",
    "repo": "Voltur792/astra-music",
    "tag": "v1.4.3",
    "commit": "509c6a2471fb9732520354f13d48361ab6d70527"
  },
  "artifacts": {
    "noarch": {
      "url": "https://github.com/Voltur792/astra-music/releases/download/v1.4.3/music-controller-1.4.3-noarch.astraplugin",
      "filename": "music-controller-1.4.3-noarch.astraplugin",
      "sha256": "fa02cc3b119dce453767925163a36bab041a66bc4cabef14434dc40d4bb36294",
      "size": 418114
    }
  },
  "protocol": 1,
  "capabilities": [
    "actions",
    "event_handlers",
    "tools",
    "ui_contributions"
  ],
  "permissions": {
    "send_chat_message": {
      "reason": "Optional radio presenter: announces songs using Astra's configured personality, model and voice only when enabled by the user"
    },
    "subscribe_events": {
      "reason": "Temporarily lower the music player's volume while Astra listens or speaks, including optional radio announcements, then restore it",
      "types": [
        "state_changed",
        "tts_started",
        "tts_completed",
        "tts_interrupted"
      ]
    }
  }
}
