{
  "$comment": "Derived from Voltur792/voice-text-input@v1.0.1. Digests are of the bytes the bot downloaded and the attestation covers. Ownership proved by: well-known.",
  "schema": "astra.registry.version/1",
  "id": "voice-text-input",
  "version": "1.0.1",
  "published_at": "2026-09-12T02:47:14Z",
  "release": {
    "kind": "github_release",
    "repo": "Voltur792/voice-text-input",
    "tag": "v1.0.1",
    "commit": "33ab1930d91e1d3b8ac1824c53a92e5c0481698b"
  },
  "artifacts": {
    "noarch": {
      "url": "https://github.com/Voltur792/voice-text-input/releases/download/v1.0.1/voice-text-input-1.0.1-noarch.astraplugin",
      "filename": "voice-text-input-1.0.1-noarch.astraplugin",
      "sha256": "3167a57ec77e3692c5f077f2cb9b93c1ba2cf296b6a1e0ad00b9222e092bc61a",
      "size": 43375
    }
  },
  "protocol": 1,
  "capabilities": [
    "stt",
    "tools"
  ],
  "permissions": {}
}
