{
  "$comment": "Derived from FluffyTaill/astra-remote@v0.7.0. Digests are of the bytes the bot downloaded and the attestation covers. Ownership proved by: unrecorded.",
  "schema": "astra.registry.version/1",
  "id": "phone-remote",
  "version": "0.7.0",
  "published_at": "2026-10-27T22:47:41Z",
  "review": "unreviewed",
  "release": {
    "kind": "github_release",
    "repo": "FluffyTaill/astra-remote",
    "tag": "v0.7.0",
    "commit": "7defcc35008ac9e6b40dcb2b6931db1cb9be50bf"
  },
  "artifacts": {
    "noarch": {
      "url": "https://github.com/FluffyTaill/astra-remote/releases/download/v0.7.0/phone-remote-0.7.0-noarch.astraplugin",
      "filename": "phone-remote-0.7.0-noarch.astraplugin",
      "sha256": "bbcbc4553220e232cb85a7d661ff500f884a2702250da317e9ebe21fbf9531eb",
      "size": 306600
    }
  },
  "protocol": 1,
  "capabilities": [
    "client",
    "tools",
    "triggers",
    "ui_contributions"
  ],
  "permissions": {
    "client": {
      "reason": "The phone app is a chat with Astra: what you type or say on the phone goes to Astra as if you typed it here."
    },
    "fire_trigger": {
      "reason": "The buttons on the phone run the Astra commands you hang on the \"Phone Remote: button N\" triggers."
    },
    "send_chat_message": {
      "reason": "Sends your messages from the phone to Astra and streams her reply back to the phone."
    }
  }
}
